{
  "contract": "ll.derived-manifest/1",
  "status": "complete",
  "kind": "speech_timing",
  "course_id": "fixture-course",
  "generation": "gen-fixture-0001",
  "created_at": "2026-10-05T12:00:00Z",
  "consumer_version": "derived-consumer-1",
  "recording": {
    "source_id": "src-fixture-recording",
    "sha256": "aaaaaaaaaaaaaaaaaaaaaaaaaaaaaaaaaaaaaaaaaaaaaaaaaaaaaaaaaaaaaaaa",
    "bytes": 480044,
    "duration_ms": 5100000
  },
  "producer": {
    "tool": "synthetic-fixture-producer",
    "tool_version": "0.0.0",
    "model": "none-synthetic",
    "language": "en",
    "parameters_sha256": "bbbbbbbbbbbbbbbbbbbbbbbbbbbbbbbbbbbbbbbbbbbbbbbbbbbbbbbbbbbbbbbb"
  },
  "window": {
    "start_ms": 0,
    "end_ms": 120000
  },
  "time_base": "clip_relative",
  "clip_offset_ms": 0,
  "input_fingerprint": "b16c8aff84a7531fbfa95272fb564cdce41e35d9d15846a4c3df935c26bc20dd",
  "segments_path": "segments.json",
  "outputs": [
    {
      "path": "segments.json",
      "sha256": "dddddddddddddddddddddddddddddddddddddddddddddddddddddddddddddddd",
      "bytes": 12,
      "media_type": "application/json"
    }
  ],
  "text_origin": "generated_speech_text",
  "review_state": "generated_unreviewed",
  "establishes": []
}
